{
  "book": "Titus",
  "book_number": 56,
  "verified": true,
  "total_items": 75,
  "improved_count": 75,
  "category_distribution": {
    "literary_parallel": 34,
    "elaboration": 8,
    "historical_reference": 2,
    "thematic_echo": 24,
    "allusion": 4,
    "parallel_instruction": 2,
    "prophecy_fulfillment": 1
  },
  "items": [
    {
      "anchor_ref": "Titus.1.1",
      "cross_ref": "1Tim.2.4",
      "primary_category": "literary_parallel",
      "secondary_category": "thematic_echo",
      "confidence": 90,
      "reasoning": "1 Timothy states God 'wants all people to be saved and to come to a knowledge of the truth,' paralleling Titus' opening: 'for the faith of God's elect and their knowledge of the truth.' Literary parallel showing Pastoral Epistles' consistent universal soteriology\u2014God's salvific will extends to all, though actualized in the elect who believe."
    },
    {
      "anchor_ref": "Titus.1.2",
      "cross_ref": "2Tim.1.1",
      "primary_category": "literary_parallel",
      "secondary_category": null,
      "confidence": 90,
      "reasoning": "2 Timothy grounds Paul's apostleship in 'the promise of life that is in Christ Jesus,' paralleling Titus' 'resting on the hope of eternal life.' Literary parallel\u2014both Pastoral Epistles root apostolic authority in God's life-giving promise. The parallel shows consistent apostolic self-understanding as herald of divine promise."
    },
    {
      "anchor_ref": "Titus.1.2",
      "cross_ref": "2Tim.1.9",
      "primary_category": "literary_parallel",
      "secondary_category": "thematic_echo",
      "confidence": 90,
      "reasoning": "2 Timothy affirms grace 'given us in Christ Jesus before the beginning of time,' paralleling Titus' 'eternal life...promised before the beginning of time.' Literary parallel showing Pastoral Epistles' emphasis on pretemporal divine planning. God's salvific purpose predates creation, guaranteeing its fulfillment."
    },
    {
      "anchor_ref": "Titus.1.2",
      "cross_ref": "Titus.3.7",
      "primary_category": "elaboration",
      "secondary_category": null,
      "confidence": 95,
      "reasoning": "Titus 1:2 introduces 'hope of eternal life' as opening theme, which 3:7 elaborates: 'having been justified by his grace, we might become heirs having the hope of eternal life.' Elaboration within epistle\u2014later verse unpacks how hope connects to justification and inheritance. The hope framing the letter's opening finds theological grounding in the closing."
    },
    {
      "anchor_ref": "Titus.1.3",
      "cross_ref": "1Tim.1.1",
      "primary_category": "literary_parallel",
      "secondary_category": null,
      "confidence": 90,
      "reasoning": "Both 1 Timothy and Titus identify 'God our Savior' as commissioning authority. Literary parallel showing Pastoral Epistles' distinctive use of 'Savior' (s\u014dt\u0113r) for God the Father\u2014relatively rare in Paul's earlier letters. The parallel demonstrates consistent theological vocabulary within Pastoral corpus."
    },
    {
      "anchor_ref": "Titus.1.3",
      "cross_ref": "1Tim.1.11",
      "primary_category": "literary_parallel",
      "secondary_category": null,
      "confidence": 85,
      "reasoning": "1 Timothy references 'the gospel...that he entrusted to me,' paralleling Titus' 'preaching entrusted to me by the command of God.' Literary parallel showing Paul's consistent understanding of gospel ministry as divine stewardship. Apostolic preaching isn't personal message but entrusted deposit requiring faithful transmission."
    },
    {
      "anchor_ref": "Titus.1.3",
      "cross_ref": "Titus.2.10",
      "primary_category": "elaboration",
      "secondary_category": null,
      "confidence": 85,
      "reasoning": "Titus 1:3 refers to 'God our Savior,' which 2:10 elaborates by describing how believers 'make the teaching about God our Savior attractive.' Elaboration showing how divine salvation becomes visible through transformed conduct. God's saving character is manifested in community ethics."
    },
    {
      "anchor_ref": "Titus.1.4",
      "cross_ref": "2Cor.2.13",
      "primary_category": "historical_reference",
      "secondary_category": null,
      "confidence": 85,
      "reasoning": "Paul mentions Titus as co-worker in 2 Corinthians: 'I still had no peace of mind, because I did not find my brother Titus there.' Titus epistle addresses same person\u2014historical reference confirming biographical details. The cross-reference establishes Titus' long ministry partnership with Paul."
    },
    {
      "anchor_ref": "Titus.1.4",
      "cross_ref": "2Tim.4.10",
      "primary_category": "historical_reference",
      "secondary_category": null,
      "confidence": 90,
      "reasoning": "2 Timothy references 'Titus has gone to Dalmatia,' confirming same historical figure. Historical reference showing Titus' missionary itinerancy. The reference places this epistle before Titus' Dalmatian mission, providing chronological framework for Titus' Cretan ministry."
    },
    {
      "anchor_ref": "Titus.1.6-9",
      "cross_ref": "1Tim.3.2-7",
      "primary_category": "literary_parallel",
      "secondary_category": "parallel_instruction",
      "confidence": 95,
      "reasoning": "Nearly identical elder/overseer qualification lists appear in both Pastoral Epistles: blameless, one wife, manages household well, not violent/quarrelsome, hospitable, able to teach, etc. Direct literary parallel showing consistent church order standards. Both texts establish same leadership requirements, confirming unified Pastoral ecclesiology."
    },
    {
      "anchor_ref": "Titus.1.6-9",
      "cross_ref": "2Tim.2.24-26",
      "primary_category": "literary_parallel",
      "secondary_category": "thematic_echo",
      "confidence": 85,
      "reasoning": "2 Timothy describes Lord's servant as 'not quarrelsome but kind to everyone, able to teach, not resentful,' paralleling Titus' elder qualifications: 'not quick-tempered...holding firmly to the trustworthy message as it has been taught.' Literary parallel showing consistent Pastoral emphasis on teaching ability and gentle temperament for leaders."
    },
    {
      "anchor_ref": "Titus.1.7",
      "cross_ref": "1Cor.4.1",
      "primary_category": "thematic_echo",
      "secondary_category": "shared_metaphor",
      "confidence": 85,
      "reasoning": "Paul calls apostles 'those entrusted with the mysteries God has revealed' (stewards), which Titus echoes by calling overseer 'God's steward' (oikonomos). Both use stewardship metaphor for ministerial responsibility. Thematic echo showing church leadership as divine entrustment requiring faithful management."
    },
    {
      "anchor_ref": "Titus.1.9",
      "cross_ref": "1Tim.1.10",
      "primary_category": "literary_parallel",
      "secondary_category": null,
      "confidence": 90,
      "reasoning": "Both Pastoral Epistles reference 'sound doctrine' (hygiainous\u0113 didaskalia): 1 Timothy lists vices contrary to it; Titus requires elders to hold firmly to it. Literary parallel showing distinctive Pastoral vocabulary\u2014'sound doctrine' appears almost exclusively in these letters. The health metaphor portrays orthodox teaching as spiritual wellness."
    },
    {
      "anchor_ref": "Titus.1.9",
      "cross_ref": "2Tim.4.3",
      "primary_category": "literary_parallel",
      "secondary_category": "thematic_echo",
      "confidence": 90,
      "reasoning": "2 Timothy warns of time when people 'will not endure sound teaching,' paralleling Titus' requirement that elders 'hold firmly to the trustworthy message' to refute those opposing it. Literary parallel showing Pastoral concern with doctrinal drift. Sound teaching requires active defense against false alternatives."
    },
    {
      "anchor_ref": "Titus.1.9",
      "cross_ref": "Titus.2.1",
      "primary_category": "elaboration",
      "secondary_category": null,
      "confidence": 95,
      "reasoning": "Titus 1:9 requires elders to hold to sound doctrine and refute opponents, which 2:1 applies to Titus: 'You, however, must teach what is appropriate to sound doctrine.' Elaboration\u2014elder qualification becomes ministerial mandate. The requirement for elders becomes Titus' own teaching responsibility."
    },
    {
      "anchor_ref": "Titus.1.10",
      "cross_ref": "1Tim.1.6",
      "primary_category": "literary_parallel",
      "secondary_category": "thematic_echo",
      "confidence": 85,
      "reasoning": "1 Timothy describes those who 'have turned to meaningless talk,' paralleling Titus' description of 'many rebellious people, full of meaningless talk.' Literary parallel showing Pastoral concern with empty theological speculation. Both texts critique verbosity divorced from truth and godliness."
    },
    {
      "anchor_ref": "Titus.1.11",
      "cross_ref": "1Tim.5.13",
      "primary_category": "thematic_echo",
      "secondary_category": null,
      "confidence": 80,
      "reasoning": "1 Timothy warns about idle people going 'about from house to house...saying things they ought not to,' echoing Titus' concern with false teachers who 'are disrupting whole households.' Both texts address domestic infiltration by troublemakers. Thematic echo of concern for protecting household integrity from false teaching."
    },
    {
      "anchor_ref": "Titus.1.13",
      "cross_ref": "1Tim.5.20",
      "primary_category": "literary_parallel",
      "secondary_category": "thematic_echo",
      "confidence": 85,
      "reasoning": "1 Timothy instructs 'rebuke publicly' those who persist in sin; Titus commands 'rebuke them sharply' (the false teachers). Literary parallel showing Pastoral emphasis on public correction. Both texts balance gentleness with firm rebuke when necessary for community health."
    },
    {
      "anchor_ref": "Titus.1.14",
      "cross_ref": "Col.2.22",
      "primary_category": "thematic_echo",
      "secondary_category": "allusion",